First Name,Last Name,Title,Company Name,Company Name for Emails,Email,Email Status,Primary Email Source,Primary Email Verification Source,Email Confidence,Primary Email Catch-all Status,Primary Email Last Verified At,Seniority,Departments,Contact Owner,Work Direct Phone,Home Phone,Mobile Phone,Corporate Phone,Other Phone,Stage,Lists,Last Contacted,Account Owner,# Employees,Industry,Keywords,Person Linkedin Url,Website,Company Linkedin Url,Facebook Url,Twitter Url,City,State,Country,Company Address,Company City,Company State,Company Country,Company Phone,Technologies,Annual Revenue,Total Funding,Latest Funding,Latest Funding Amount,Last Raised At,Subsidiary of,Email Sent,Email Open,Email Bounced,Replied,Demoed,Number of Retail Locations,Apollo Contact Id,Apollo Account Id,Secondary Email,Secondary Email Source,Secondary Email Status,Secondary Email Verification Source,Tertiary Email,Tertiary Email Source,Tertiary Email Status,Tertiary Email Verification Source
Abdulazeez,Oguntoyinbo,CEO,EsusuAfrica,EsusuAfrica,abdulazeez@esusu.africa,Verified,Apollo,Apollo,"","",2025-09-06T13:26:27+00:00,C suite,C-Suite,godgraceissufficient@gmail.com,"","","",'+234 816 590 4908,"",Cold,"","",godgraceissufficient@gmail.com,13,financial services,"branch and employee management, multi-channel communication, customizable loan products, financial services, fintech, client management system, trust building in financial services, agent network capacity building, data import/export, instant sms & email alerts, client onboarding, cash handling risk reduction, manual savings scheme digitization, api integration for value-added services, rural microfinance solutions, field operations tracking, financial inclusion platform, open api compliance, customer and agent management, information technology, user-friendly interface, group contribution automation, data security and privacy, banking, disaster recovery for financial data, microfinance, financial literacy enhancement, microfinance software, cloud-based financial system, savings scheme automation, accounting integration, real-time transaction tracking, operational efficiency, digital finance management, mobile money integration, petty trader finance management, microfinance best practices, mobile responsive microfinance app, savings and loan management, real-time reporting, thrift savings automation, credit scheme management, last mile financial inclusion, role-based access control, b2b, non-profit, services, other activities related to credit intermediation, data security, risk management, customer engagement, business intelligence, finance technology, information technology & services, nonprofit organization management, computer & network security, analytics",http://www.linkedin.com/in/abdulazeezoguntoyinbo,https://esusu.africa,http://www.linkedin.com/company/esusuafrica,https://facebook.com/esusuafrica,https://twitter.com/esusuafrica,"","",Nigeria,"27 Araromi St, Lagos, Lagos, Nigeria",Lagos,Lagos,Nigeria,'+234 816 590 4908,"Google Font API, YouTube, Mobile Friendly, WordPress.org, AI","","","","","","","",false,false,false,false,"",68dbf9aab4d65b001a302522,68dbf9aab4d65b001a302524,"","","","","","","",""
Yemi,Olulana,CEO,Flex Finance,Flex Finance,yemi@flexfinance.ai,Verified,Apollo,Apollo,"",Not Catch-all,2025-09-01T14:07:00+00:00,C suite,C-Suite,godgraceissufficient@gmail.com,"","","",'+234 906 935 3884,"",Cold,"","",godgraceissufficient@gmail.com,41,financial services,"",http://www.linkedin.com/in/yemi-olulana,https://useflexfinance.com,http://www.linkedin.com/company/flexfinance,https://facebook.com/useflexfi,https://twitter.com/useflexfi,"",Lagos,Nigeria,"2 Alhaji Tokan St, Lagos, Lagos, Nigeria",Lagos,Lagos,Nigeria,'+234 906 935 3884,"Cloudflare DNS, Amazon SES, Mailchimp Mandrill, CloudFlare Hosting, AWS SDK for JavaScript, Pipedrive, Webflow, Varnish, Twitter Advertising, Mobile Friendly, YouTube, Facebook Custom Audiences, Facebook Widget, Facebook Login (Connect), Google Tag Manager, AI","",100000,Other,"",2021-12-01T00:00:00+00:00,"","",false,false,false,false,"",68dbf9b41f5be60011c0d246,68dbf9b41f5be60011c0d248,"","","","","","","",""
Segun,Adeyemi,CEO,Anchor,Anchor,segun@getanchor.co,Verified,Apollo,Apollo,"",Catch-all,2025-09-09T10:45:17+00:00,C suite,C-Suite,godgraceissufficient@gmail.com,"","","","","",Cold,"","",godgraceissufficient@gmail.com,26,financial services,"fintech, africa, financial services, technology, bankingasaservice, banking api, account management, virtual accounts, developer tools, scalable api, embedded finance, card issuance api, financial infrastructure, interest-bearing accounts, financial product building, loan management, savings and investment apis, financial services for africa, money transfers, fixed deposit api, virtual nuban accounts, banking, b2b payments, digital wallet api, banking-as-a-service, kyb & onboarding api, api solutions, multi-currency accounts, bulk transfers api, payment processing, compliance automation, custom banking solutions, fintech api platform, b2b, b2b2c, d2c, services, financial transactions processing, reserve, and clearinghouse activities, payments, finance technology, information technology & services, enterprise software, enterprises, computer software",http://www.linkedin.com/in/segunadeyemi,https://getanchor.co,http://www.linkedin.com/company/getanchor,https://www.facebook.com/buildwithanchor,https://twitter.com/buildwithanchor,Lagos,Lagos,Nigeria,"Okotie Eboh St, Lagos, Lagos, Nigeria",Lagos,Lagos,Nigeria,"","Gmail, Google Apps, Amazon AWS, Cloudinary, Google Tag Manager, Vimeo, Google Font API, Cedexis Radar, Adobe Media Optimizer, Mobile Friendly, Remote, AI",3111000,3400000,Seed,2400000,2023-09-01T00:00:00+00:00,"","",false,false,false,false,"",68dbf988be720d00151eb73f,68dbf988be720d00151eb740,"","","","","","","",""
Akin,Akintunde,CEO,The SIS group,The SIS group,aa@gi-cc.com,Verified,Apollo,Apollo,"",Not Catch-all,2025-09-22T13:48:27+00:00,C suite,C-Suite,godgraceissufficient@gmail.com,"","","","","",Cold,"","",godgraceissufficient@gmail.com,6,financial services,"quality inspections & quantity inspections, africa, popi act, supply chain, quality control, strategic partnerships, oil and gas, financial services, african collateral management, industry sectors, logistics management, agriculture, inspection and verification, supply chain audits in africa, transparency, iso9001:2015, commodity storage, client reporting, custodial services, africa operations, risk assessment, commodity custodianship, inspections, industry compliance, inventory management, minerals, gafta 124, market expansion, asset management, logistics and supply chain, fosfa, asset monitoring, supply chain logistics, risk management, risk mitigation, commodity custody, inspection and audit in africa, inspection services, stock monitoring, commodity storage oversight, client relationships, quality assurance, supply chain oversight, logistics solutions, regional inspection services, african supply chain management, operational audits, trust, asset control, compliance, commodity risk mitigation, collateral management, african logistics solutions, audits, vessel superintendence, inventory control, collateral custody in africa, regional offices, b2b, government, services, other scientific and technical consulting services, oil & energy, logistics & supply chain, auditing",http://www.linkedin.com/in/akin-akintunde-a5583a31,https://gcc-africa.com,http://www.linkedin.com/company/global-inspections-collateral-control-pty-ltd,"","","","",Nigeria,"Johannesburg, Gauteng, South Africa",Johannesburg,Gauteng,South Africa,"","Outlook, Microsoft Office 365, Rackspace Email, Linkedin Login, Mobile Friendly, Facebook Login (Connect), Linkedin Widget, Hubspot, Facebook Widget","","","","","","","",false,false,false,false,"",68dbf9e3e1f226001901d99d,68dbf9e3e1f226001901d99e,akinakintunde@yahoo.com,Apollo,Verified,Apollo,"","","",""
Suleiman,Ibrahim,CEO,FSDH Group,FSDH Group,sibrahim@fsdhgroup.com,Verified,Apollo,Apollo,"",Not Catch-all,2025-09-23T19:56:07+00:00,C suite,C-Suite,godgraceissufficient@gmail.com,"","","",'+234 1 270 2880,"",Cold,"","",godgraceissufficient@gmail.com,21,financial services,"pension fund management, investment banking, asset aggregation in nigeria, asset management, securities trading, asset aggregation, investment solutions, dealing member, special-purpose schemes, financial services, portfolio management, capital markets, pension fund administration, merchant banking, investment products, banking services, financial group, long-term growth, financial solutions, client asset management, regulatory compliance, financial innovation, nigeria financial sector, industry expertise, corporate finance, corporate banking, client relationships, risk management, subsidiaries, client focus, eurobonds, treasury services, market analysis, treasury bill funds, financial advisory, financial regulation, fund management, investment banking services, pension administration, b2b, services, securities and commodity contracts intermediation and brokerage, financial consulting, consulting, management consulting",http://www.linkedin.com/in/dr-suleiman-ibrahim-ph-d-cppps-5932b439,https://fsdhgroup.com,http://www.linkedin.com/company/fsdh-group,https://facebook.com/FSDHMerchantBank/,https://twitter.com/FSDHBank,"",Lagos,Nigeria,"1 Odunlami St, Lagos, Lagos, Nigeria",Lagos,Lagos,Nigeria,'+234 1 270 2880,"Cloudflare DNS, Outlook, CloudFlare Hosting, Mobile Friendly, Google Tag Manager, Woo Commerce, Google Font API, Shutterstock, YouTube, WordPress.org",16713000,"",Other,"",2017-09-01T00:00:00+00:00,FSDH Merchant Bank (fsdhmerchantbank.com),"",false,false,false,false,"",68dbf9af42e9dd001d6a3156,68dbf9af42e9dd001d6a3158,"","","","","","","",""
Jide,Ogundare,CEO,MBO Capital Management Limited,MBO Capital Management,jide@mbocapital.com,Verified,Apollo,Apollo,"","",2025-09-25T13:39:31+00:00,C suite,C-Suite,godgraceissufficient@gmail.com,"","","",'+234 1 460 8193,"",Cold,"","",godgraceissufficient@gmail.com,33,venture capital & private equity,"private equity finance, venture capital & private equity principals, investment in smes, strategic support, investment themes, stakeholder engagement, portfolio management, business support, west africa, investment strategy, sme funding, impact investment africa, investment analysis, due diligence, economic development, portfolio companies, west africa investment, principal investments, investment management, long-term investor relationships, private equity fund manager, business growth, strategic investment, financial support, private equity, sustainability, sme financing nigeria, fund management, operational support, business growth support, business development, risk management, long-term relationships, local sourcing, financial services, exit strategies, nigeria, growth capital, impact investing, capital structuring, value creation, venture capital, women empowerment investments, regulatory compliance, sustainable business practices, private capital deployment, export-oriented businesses, investment process, risk-adjusted returns, capital deployment, fundraising, market development, b2b, services, other financial investment activities, environmental services, renewables & environment, venture capital & private equity, fund-raising",http://www.linkedin.com/in/jide-ogundare-1a6b004a,https://mbocapital.com,http://www.linkedin.com/company/mbo-capital-management-limited,"","",Lagos,Lagos,Nigeria,"20 Alexander Road, Lagos, Lagos, Nigeria",Lagos,Lagos,Nigeria,'+234 1 460 8193,"Cloudflare DNS, Outlook, Microsoft Office 365, CloudFlare Hosting, Google Font API, Vimeo, Google Maps, Google Analytics, Mobile Friendly, WordPress.org, Google Tag Manager","","","","","","","",false,false,false,false,"",68dbf9be61ae85001d45c773,68dbf9be61ae85001d45c775,"","","","","","","",""
Ayo,Adewuyi,CEO,Pouchers,Pouchers,ayo@pouchers.io,Verified,Apollo,Apollo,"",Not Catch-all,2025-09-23T10:24:17+00:00,C suite,C-Suite,godgraceissufficient@gmail.com,"","","","","",Cold,"","",godgraceissufficient@gmail.com,9,financial services,"",http://www.linkedin.com/in/ayoadewuyi,https://pouchers.io,http://www.linkedin.com/company/pouchersio,"","","",Lagos,Nigeria,"Lagos, Lagos, Nigeria",Lagos,Lagos,Nigeria,"","Cloudflare DNS, Gmail, Google Apps, CloudFlare Hosting, Mobile Friendly, WordPress.org","","","","","","","",false,false,false,false,"",68dbf992df19bf0011c7bfa7,68dbf992df19bf0011c7bfa8,"","","","","","","",""
Tope,Omojokun,CEO,FCSL Asset Management Limited,FCSL Asset Management,tomojokun@fcslng.com,Verified,Apollo,Apollo,"",Not Catch-all,2025-09-25T13:39:48+00:00,C suite,C-Suite,godgraceissufficient@gmail.com,"","","","","",Cold,"","",godgraceissufficient@gmail.com,51,capital markets,"capital market, portfolio management, bonds, treasury bills, financial advisory, investment services, fixed income securities, broker/dealer, investment strategies, asset management, capital markets, market intelligence, financial services, ipo services, nigeria financial market, wealth management, capital market transactions, share management, fmdq platform, nasd exchange, investment banking, fixed income trading, bond issuance, securities trading, investment solutions for diaspora, corporate bond issuance, regulatory licensing, market analysis, capital raising, equities trading, financial consulting, securities brokerage, equity offerings, market research, debt and equity financing, asset allocation, issuance of bonds, market making services, private placements, corporate finance, market research reports, advisory services, financial market analysis, market maker, b2b, consulting, services, securities and commodity contracts intermediation and brokerage, management consulting, investment management",http://www.linkedin.com/in/tope-omojokun-phd-fica-m-iod-acs-00140822,https://fcslng.com,http://www.linkedin.com/company/fcslng,"","","","",Nigeria,"15 Ribadu Road, Lagos, Lagos, Nigeria",Lagos,Lagos,Nigeria,"","Outlook, Microsoft Office 365, WordPress.org, Bootstrap Framework, Facebook Custom Audiences, Twitter Advertising, Apache, Google Tag Manager, Facebook Widget, Mobile Friendly, Facebook Login (Connect), OpenSSL, AI","","","","","","","",false,false,false,false,"",68dbf9c5c56c1d00117d95e9,68dbf9c5c56c1d00117d95ea,"","","","","","","",""
Matthew,Okwe,CEO,TechFusion,TechFusion,matt@techfsn.com,Verified,Apollo,Apollo,"",Not Catch-all,2025-09-02T18:23:11+00:00,C suite,C-Suite,godgraceissufficient@gmail.com,"","","","","",Cold,"","",godgraceissufficient@gmail.com,11,financial services,"",http://www.linkedin.com/in/matthew-okwe-6240201b,https://techfsn.com,http://www.linkedin.com/company/techfusionafrica,"","","","",Nigeria,"Abuja, Federal Capital Territory, Nigeria",Abuja,Federal Capital Territory,Nigeria,"","Cloudflare DNS, CloudFlare Hosting, Mobile Friendly","","","","","","","",false,false,false,false,"",68dbf9fbf5ca8b0011483e46,68dbf9fbf5ca8b0011483e47,"","","","","","","",""
Kingsley,Ibe,CEO,Creditchek,Creditchek,kingsley@creditchek.africa,Verified,Apollo,Apollo,"",Not Catch-all,2025-09-12T10:34:41+00:00,C suite,C-Suite,godgraceissufficient@gmail.com,"","","","","",Cold,"","",godgraceissufficient@gmail.com,12,financial services,"information technology, saas platform, identity verification, api reliability, data security, bank statement parser, income analysis, identity spectrum, credit bureau data africa, data encryption, regulatory compliance, credit insights, open banking api, credit risk analysis, microfinance, scalability, cross-border credit assessment, encryption technology, consumer banking data, ai-driven insights, financial inclusion, income insights, api integration, credit data platform, credit bureau data, digital financial services, cooperative credit digitization, fintech, financial services, financial inclusion africa, fraud reduction, credit bureau integration, consumer data analysis, recova, credit assessment, creditworthiness verification, speed, credit assessment africa, retail buy now pay later, microfinance credit tools, b2b, services, financial transactions processing, reserve, and clearinghouse activities, risk management, risk assessment, information technology & services, computer & network security, finance technology",http://www.linkedin.com/in/ibekingsley,https://creditchek.africa,http://www.linkedin.com/company/creditchek,https://www.facebook.com/creditchekHQ,https://www.twitter.com/creditchek_hq,"","",Nigeria,"Lagos, Lagos, Nigeria",Lagos,Lagos,Nigeria,"","Cloudflare DNS, Amazon SES, Gmail, Google Apps, CloudFlare Hosting, Digital Ocean DNS, Netlify, Create React App, Google Tag Manager, Mobile Friendly, Bootstrap Framework, Remote","",240000,Other,"",2025-01-01T00:00:00+00:00,"","",false,false,false,false,"",68dbf98e1d0326001d260e2f,68dbf98e1d0326001d260e30,"","","","","","","",""
Morris,Omotayo,CEO,Finspa Investment Limited,Finspa Investment,morris.tayo@finspainvestment.com,Verified,Apollo,Apollo,"",Catch-all,2025-09-16T20:36:51+00:00,C suite,C-Suite,godgraceissufficient@gmail.com,"","","","","",Cold,"","",godgraceissufficient@gmail.com,10,financial services,"quick cash, device financing, investment, micro lending, nigerian financial sector, digital loan application, salary-based loans, customer success stories, nigerian micro lending, consumer finance, investment plans, payment solutions, financial services, customer-centric, minimal documentation, financial advisory, loans, financial trust building, financial wellness, payment for gadgets, appliance financing, nigerian market, revenue growth strategies, financial empowerment, expertise, personalized financial advice, personalized service, investment minimum, financial solutions, investment opportunities, loan eligibility, interest payment options, flexible interest payments, salary earners, quick disbursement, confidentiality, financial security, loan services, payment plans, timely fund disbursement, client satisfaction, transparency, digital financial services, nitda compliance, fast funding, b2c, d2c, services, other nondepository credit intermediation, wealth management, financial consulting, consulting, management consulting, investment management",http://www.linkedin.com/in/morris-omotayo,https://finspainvestment.com,http://www.linkedin.com/company/finspa-investment-limited,https://www.facebook.com/profile.php,https://twitter.com/Finspainv,"","",Nigeria,"Providence Este, Lagos, Lagos, Nigeria",Lagos,Lagos,Nigeria,"","Outlook, Microsoft Office 365, Amazon AWS, Mobile Friendly","","","","","","","",false,false,false,false,"",68dbf9e977393d00154bec5c,68dbf9e977393d00154bec5d,"","","","","","","",""
Michael,Collins,CEO,MCO Penny Limited,MCO Penny,michael.collins@mcopenny.ng,Verified,Apollo,Apollo,"",Not Catch-all,2025-09-18T17:15:00+00:00,C suite,C-Suite,godgraceissufficient@gmail.com,"","","",'+234 906 831 0708,"",Cold,"","",godgraceissufficient@gmail.com,8,financial services,"loan approval time, public sector payroll loans, investment management, supporting documents submission, disbursement to bank accounts, quick loans & financial services, fast approval in 1 hour, emergency loans nigeria, investment opportunities, microfinance, loan services, public sector financial support, civil servant loans, loan approval process, collateral-free loans, no collateral loans, financial services, salary advance nigeria, asset acquisition loans, flexible repayment plans, loan application form, microfinance nigeria, public sector financial solutions, customer support, b2b, b2c, d2c, government, services, other activities related to credit intermediation",http://www.linkedin.com/in/michael-collins-781539209,https://mcopenny.ng,http://www.linkedin.com/company/mco-penny-limited,https://web.facebook.com/mcopenny/,"",Lagos,Lagos,Nigeria,"Ogba Rd, Lagos, Lagos, Nigeria",Lagos,Lagos,Nigeria,'+234 906 831 0708,"WordPress.org, Mobile Friendly, Google Font API","","","","","","","",false,false,false,false,"",68dbf9b9d38f9d000dcb07f7,68dbf9b9d38f9d000dcb07f9,"","","","","","","",""
Ruth,Olojede,CEO,Flick (Techstars ‘22),Flick,ruth@getflick.co,Verified,Apollo,Apollo,"",Catch-all,2025-09-22T20:52:07+00:00,C suite,C-Suite,godgraceissufficient@gmail.com,"","","",'+1 647-646-6753,"",Cold,"","",godgraceissufficient@gmail.com,16,financial services,"",http://www.linkedin.com/in/ruth-olojede,https://getflick.co,http://www.linkedin.com/company/getflick,"","","",Lagos,Nigeria,"Lagos, Lagos, Nigeria",Lagos,Lagos,Nigeria,'+1 647-646-6753,"Route 53, Gmail, Google Apps, Mobile Friendly, Google Frontend (Webserver), Bootstrap Framework, Google Tag Manager, Intercom","","","","","","","",false,false,false,false,"",68dbf98345823300159ddc38,68dbf98345823300159ddc3a,"","","","","","","",""
Evue,Samuel,CEO,LINK CREDIT,LINK CREDIT,sammy@linkcredit.ng,Verified,Apollo,Apollo,"","",2025-09-15T12:26:59+00:00,C suite,C-Suite,godgraceissufficient@gmail.com,"","","","","",Cold,"","",godgraceissufficient@gmail.com,27,financial services,"low interest rate, loan limit increase, digital financial innovation, no paper documents loan, revolving credit, mobile loan app, privacy protection, credit assessment, personal loan, mobile app loan application, financial technology nigeria, digital financial services, mobile banking, revolving credit nigeria, secure data encryption, interest rate, loan approval process, online loan approval nigeria, loan repayment, secure mobile lending, mobile loan nigeria, digital banking, fully online process, loan application nigeria, app-based lending, online loan platform, online credit check, app-based financial services, financial services, instant loan approval, digital loan management, nigeria financial technology, fast loan disbursement nigeria, fast approval, digital credit platform, secure online platform, revolving line of credit, no collateral, fintech, personal loans, loan disbursement, credit limit check, instant credit nigeria, b2c, services, other activities related to credit intermediation, customer service, finance technology, information technology & services",http://www.linkedin.com/in/evue-samuel-4a71aa148,https://linkcredit.ng,http://www.linkedin.com/company/link-credit,"","",Ikeja,Lagos,Nigeria,"Lagos, Lagos, Nigeria",Lagos,Lagos,Nigeria,"","Baidu Ads, Mobile Friendly, Nginx, Google Play","","","","","","","",false,false,false,false,"",68dbf9a19e2ef30015875789,68dbf9a19e2ef3001587578a,"","","","","","","",""
Taba,Peterside,CEO,Waveline Growth Partners,Waveline Growth,tpeterside@waveline.com.ng,Verified,Apollo,Apollo,"",Not Catch-all,2025-09-16T12:46:15+00:00,C suite,C-Suite,godgraceissufficient@gmail.com,"","","",'+234 708 391 5500,"",Cold,"","",godgraceissufficient@gmail.com,11,financial services,"microenterprise growth, women empowerment programs, sme loans, minimal documentation, digital loan platform, individual micro loans, microcredit, microfinance technology, msme financing, financial technology, loan products, customer relations, tailored financial solutions, banking, mobile money, microenterprise, loan repayment, loan management, nigeria, digital banking, transparent pricing, microfinance nigeria, microfinance, community development, financial literacy, tailored loans, microfinance outreach, financial inclusion, customer service, financial services, financial empowerment, business support, microfinance compliance, community banking, non-bank financial institution, api integration, fast disbursement, women empowerment, women entrepreneurs, group loan management, business growth, sme asset financing, small business support, salary loans, msme loans, customer engagement, salary deduction loans, microfinance innovation, credit access, digital financial services, micro lending, group loans, b2c, d2c, services, other nondepository credit intermediation, risk assessment, finance technology, information technology & services",http://www.linkedin.com/in/taba-peterside-f-ciod-mcib-797938ba,https://waveline.com.ng,http://www.linkedin.com/company/wavelinegrowthpartners,https://www.facebook.com/wavelinegrowthpartners,https://twitter.com/wavelinegrowth,"","",Nigeria,"Lekki-Epe Expy, Lagos, Lagos, Nigeria",Lagos,Lagos,Nigeria,'+234 708 391 5500,"Outlook, Microsoft Office 365, Google Maps (Non Paid Users), Google Font API, Bootstrap Framework, Apache, Mobile Friendly, Google Maps, Google Analytics, Micro","","","","","","","",false,false,false,false,"",68dbf9d013345f0021ddaf48,68dbf9d013345f0021ddaf4a,"","","","","","","",""
Ndumanya,Raphael,CEO,Trading,Trading,ndumanya.raphael@etrade.com,Verified,Apollo,Apollo,"",Catch-all,2025-09-29T04:26:00+00:00,C suite,C-Suite,godgraceissufficient@gmail.com,"","","",'+91 95825 90906,"",Cold,"","",godgraceissufficient@gmail.com,18,financial services,"real estate, promoters, colonizers, developers",http://www.linkedin.com/in/ndumanya-raphael-7b809453,https://apextradeinvestment.online,http://www.linkedin.com/company/adwik-group,"","","","",Nigeria,"Service Lane, Ghaziabad, Uttar Pradesh, India, 201009",Ghaziabad,Uttar Pradesh,India,'+91 95825 90906,"Nginx, Google AdSense, Mobile Friendly, DoubleClick","","","","","","","",false,false,false,false,"",68dbf9ca2f92f20011083bc6,68dbf9ca2f92f20011083bc8,"","","","","","","",""
